{
  "form_id": "discovery.embedding_config",
  "module": "cdeadmin.discovery_intelligence",
  "title": "Semantic Index / Embedding Configuration",
  "kind": "surface_form",
  "size": "large",
  "purpose": "Configure semantic retrieval without making generative AI a required dependency.",
  "sections": [
    {
      "id": "backend",
      "title": "Embedding",
      "fields": [
        {
          "id": "enabled",
          "label": "Semantic search enabled",
          "component": "ToggleSwitch",
          "required": true,
          "default": true,
          "validation": "Boolean.",
          "help": "",
          "secret": false,
          "visibility": "always",
          "enabled": "always",
          "options": [],
          "placeholder": null,
          "binds_to": null,
          "warning": null
        },
        {
          "id": "provider_type",
          "label": "Provider type",
          "component": "Select",
          "required": true,
          "default": "local",
          "validation": "One type.",
          "help": "",
          "secret": false,
          "visibility": "always",
          "enabled": "always",
          "options": [
            "local",
            "self_hosted",
            "remote"
          ],
          "placeholder": null,
          "binds_to": null,
          "warning": null
        },
        {
          "id": "model",
          "label": "Embedding model ID",
          "component": "TextField",
          "required": true,
          "default": "",
          "validation": "Non-empty.",
          "help": "Versioned with embeddings.",
          "secret": false,
          "visibility": "always",
          "enabled": "always",
          "options": [],
          "placeholder": null,
          "binds_to": null,
          "warning": null
        },
        {
          "id": "endpoint",
          "label": "Endpoint / runtime ref",
          "component": "TextField",
          "required": false,
          "default": "",
          "validation": "Valid configured reference.",
          "help": "",
          "secret": false,
          "visibility": "always",
          "enabled": "always",
          "options": [],
          "placeholder": null,
          "binds_to": null,
          "warning": null
        },
        {
          "id": "credential",
          "label": "Credential reference",
          "component": "SecretField",
          "required": false,
          "default": null,
          "validation": "CredentialRef only.",
          "help": "",
          "secret": true,
          "visibility": "always",
          "enabled": "always",
          "options": [],
          "placeholder": null,
          "binds_to": null,
          "warning": null
        }
      ]
    },
    {
      "id": "content",
      "title": "Input content",
      "fields": [
        {
          "id": "include_name",
          "label": "Name",
          "component": "Checkbox",
          "required": true,
          "default": true,
          "validation": "Boolean.",
          "help": "",
          "secret": false,
          "visibility": "always",
          "enabled": "always",
          "options": [],
          "placeholder": null,
          "binds_to": null,
          "warning": null
        },
        {
          "id": "include_description",
          "label": "Description",
          "component": "Checkbox",
          "required": true,
          "default": true,
          "validation": "Boolean.",
          "help": "",
          "secret": false,
          "visibility": "always",
          "enabled": "always",
          "options": [],
          "placeholder": null,
          "binds_to": null,
          "warning": null
        },
        {
          "id": "include_terms",
          "label": "Business terms",
          "component": "Checkbox",
          "required": true,
          "default": true,
          "validation": "Boolean.",
          "help": "",
          "secret": false,
          "visibility": "always",
          "enabled": "always",
          "options": [],
          "placeholder": null,
          "binds_to": null,
          "warning": null
        },
        {
          "id": "include_schema_labels",
          "label": "Schema labels",
          "component": "Checkbox",
          "required": true,
          "default": true,
          "validation": "Boolean.",
          "help": "",
          "secret": false,
          "visibility": "always",
          "enabled": "always",
          "options": [],
          "placeholder": null,
          "binds_to": null,
          "warning": null
        },
        {
          "id": "include_rows",
          "label": "Row/document content",
          "component": "Checkbox",
          "required": true,
          "default": false,
          "validation": "Boolean.",
          "help": "Default false; enabling requires special policy.",
          "secret": false,
          "visibility": "always",
          "enabled": "always",
          "options": [],
          "placeholder": null,
          "binds_to": null,
          "warning": null
        }
      ]
    },
    {
      "id": "policy",
      "title": "Egress",
      "fields": [
        {
          "id": "max_classification",
          "label": "Maximum classification",
          "component": "Select",
          "required": true,
          "default": "INTERNAL",
          "validation": "One lattice level.",
          "help": "",
          "secret": false,
          "visibility": "always",
          "enabled": "always",
          "options": [
            "PUBLIC",
            "INTERNAL",
            "CONFIDENTIAL",
            "RESTRICTED",
            "REGULATED"
          ],
          "placeholder": null,
          "binds_to": null,
          "warning": null
        },
        {
          "id": "rebuild_on_model_change",
          "label": "Rebuild affected embeddings on model change",
          "component": "Checkbox",
          "required": true,
          "default": true,
          "validation": "Boolean.",
          "help": "",
          "secret": false,
          "visibility": "always",
          "enabled": "always",
          "options": [],
          "placeholder": null,
          "binds_to": null,
          "warning": null
        }
      ]
    }
  ],
  "actions": [
    {
      "id": "test",
      "label": "Test",
      "intent": "neutral",
      "default": false,
      "closes": false,
      "enabled_when": "valid configuration",
      "command": null
    },
    {
      "id": "save",
      "label": "Save",
      "intent": "primary",
      "default": true,
      "closes": false,
      "enabled_when": "valid configuration",
      "command": null
    }
  ],
  "states": [
    "default",
    "loading",
    "invalid",
    "permission-denied",
    "error"
  ],
  "keyboard": "Tab order follows visual order; Enter invokes default only when no multiline/editor control owns Enter; Esc cancels modal forms; all pickers support keyboard search.",
  "security_notes": [
    "Embedding generation remains outside the database engine.",
    "Protected row content is excluded by default."
  ],
  "spec_gaps": []
}